{"head":{"id":20388,"layout":"Post","route":"d-o-java-u-no-co-th-t-day","title":"Đạo Java ư ? Nó có thật đấy","tags":["nerd","java"],"date":"2016-02-01T15:45:40.342Z","author":{"username":"conan4582","avatar":"/user_avatar/daynhauhoc.com/conan4582/{size}/8110_1.png"},"description":"Java - một điệp khúc muôn thuở, một vũ khí uy lực gắn liền với nhiều người và là niềm tự hào của James và Sun micsys quá cố.\nclass…"},"body":"<pre><code>Bài viết chỉ thể hiện quan điểm cá nhân dựa trên các số liệu và thu thập ý kiến\n</code></pre>\n<p>Java - một điệp khúc muôn thuở, một vũ khí uy lực gắn liền với nhiều người và là niềm tự hào của James và Sun micsys quá cố.<br>\nclass SơLượcJava {<br>\nJava có tên ban đầu là Oak, do James Gosling thiết kế và công bố hoành tráng tại hội nghị SunWorld vào tháng 5-1995. Java là một ngôn ngữ thuần túy hướng đối tượng được sử dụng rộng rãi để viết ứng dụng đa nền, Internet và cả Android. Java hiện đang là ngôn ngữ lập trình rộng rãi nhất thế giới (trên cả C/C++)<br>\nVề cá nhân thì mình thấy nó là một món đồ chơi cũ nhưng vẫn rất đẹp và không chỉ có một mình mình chơi và nó không chỉ để chơi ^^<br>\n}<br>\nSau khi đọc bài viết của Vinacode - &quot;Phát triển Phần Mềm,nó là một tôn giáo&quot;. Mình thấy nó có khá nhiều điểm tương đồng với những người thuộc &quot;Tôn giáo Java&quot;, và bạn sẽ tự hỏi rằng nó có thật không? - XIn thưa, nó hoàn toàn có thật và hiện vẫn đang rất đông tín đồ.<br>\nMột khi bạn bước chân vào Java, bất kể bạn thuộc mảng nào thì bạn cũng đang thuộc &quot;đạo Java&quot; đấy, tuy nhiên, đa phần các bạn xem nó như là một thứ ngôn ngữ bình thường, xài chán thì bỏ :) . Nhưng vẫn còn một bộ phận không ít người gắn mác &quot;Cuồng&quot; (cứ như bọn Sky ấy ^^)<br>\nĐối với một JavaNerd, họ đi đâu cũng thấy Java, không chỉ trong mã, máy tính mà cả ở thế giới thực. Họ nhìn thấy một chiếc cốc cà phê có khói nóng tỏa thì họ sẽ nghĩ ngay đến biểu tượng của Java. Họ trước khi lập trình thì lại lẩm bẩm &quot;So help me Duke&quot; (Duke là linh vật của Java) hay trước khi ăn hay uống cà phê thì lại đọc thầm &quot;To the Duke&quot;. (Giống như thiên chúa giáo ấy, ôi lạy Duke.)<br>\nKhi nghe một ai đó chê bai Java thì lại phản ứng gay gắt, &quot;Thằng khốn, Duke sẽ nguyền rủa mày!!&quot; - Một JavaNerd cho hay. và còn nhiều thứ khác...<br>\nMình không vơ đũa cả nắm nhưng chỉ với những biểu hiện ấy, bạn có thể phát hiện một JavaNerd nhưng lưu ý rằng - số lượng ngày càng tăng dần. (Như bọn Sky ấy ^^)<br>\nMình hư cấu nãy giờ cũng khá nhiều rồi, và bây giờ mình sẽ vào vấn đề chính.<br>\nVậy tại sao Java lại có sức hút như vậy?<br>\nXét về khía cạnh Marketing thì Java đã rất thành công khi có xuất thân từ một gia đình danh giá là Sun Microsystem, có một biểu tượng rất quen thuộc - tách Café và tậu hẳn một linh vật khá là... mình chẳng biết nói sao nữa. Sau cái chết của Sun, thì Java cũng chẳng trở thành đứa trẻ &quot;mồ côi&quot;, năm 2010, Oracle - một công ty khá nổi tiếng về dịch vụ và tài năng chặt chém tại Mỹ nhận nuôi và tiếp tục nuôi, cho ăn,... cho lớn. Tuy Java được ông trùm chặt chém nhận nuôi nhưng nó lại Free :) . Nên Java khá là sang chảnh.<br>\nVề khía cạnh Ứng dụng, đi đâu cũng gặp Java, từ hệ thống máy giặt, tủ lạnh cao cấp, tivi màn hình cong (không phải cái này đâu :) ). tới hệ thống cao cấp hơn như Đập đá Nokia, Phần mềm máy tính và cả ứng dụng, hệ điều hành Android và cả tựa game đình đám MineCraft . Đây được xem như là bước đệm to đùng của Java để lên cao như ngày nay.<br>\nChức năng của Java cũng không ít hấp dẫn, đó là một ngôn ngữ thuần OOP rất rõ ràng và đẹp (đẹp hơn cả Pascal), dễ dùng và dễ hiểu, Java có bộ dịch và môi trường thực thi để chạy ở mọi nơi. Java khá mạnh và an toàn (trừ mấy cái Plug in trên Web) và được thường xuyên được nâng cấp bởi Oracle và được thêm nhiều tính năng cao cấp như annotation, lambda,...<br>\nJava có hệ thống lập trình viên đông đảo và động (năng động và cả... bạo động), tài liệu hướng dẫn thì nhiều vô số kể, các trang web dạy java cũng rất nhiều, ngay cả Daynhauhoc cũng có bộ phận đông đảo người dùng Java. Java cũng khá dễ dùng, dễ cài đặt, dễ chịu và dễ học. Khi học Java, nó sẽ dạy cho người học các khái niệm lập trình cơ bản và hướng đối tượng thật sự,...<br>\nNgoài ra, Java còn có cả hệ thống Multimedia như Lady Java, Code Hard hay là những video đạo phim của JavaZone<br>\nÔi! Java thật thần thánh.<br>\nNhưng Java cũng có khá nhiều các yếu điểm.<br>\n+Phức tạp: Hệ thống thư viện và lớp rất phong phú nhưng có nhiều cái đã hết sài (như là Date thì bị thay bằng Calendar).<br>\n+Nâng cấp chậm: mặc dù Oracle đã nhận nuôi Java nhưng việc nâng cấp nó thì lại không như lúc dưới tay Sun, và cũng thua xa các ngôn ngữ lập trình khác về tốc độ nâng cấp.<br>\n...<br>\nmình hết biết gì để nói rồi ^^.<br>\nVà đó là những lợi ích của Java và những yếu điểm của Java.<br>\nKhuya rồi, mình đi ngủ đây. Ăn tết vui vẻ, anh em Daynhauhoc.</p>\n","rawBody":"\n```\nBài viết chỉ thể hiện quan điểm cá nhân dựa trên các số liệu và thu thập ý kiến\n```\nJava - một điệp khúc muôn thuở, một vũ khí uy lực gắn liền với nhiều người và là niềm tự hào của James và Sun micsys quá cố.\nclass SơLượcJava {\n   Java có tên ban đầu là Oak, do James Gosling thiết kế và công bố hoành tráng tại hội nghị SunWorld vào tháng 5-1995. Java là một ngôn ngữ thuần túy hướng đối tượng được sử dụng rộng rãi để viết ứng dụng đa nền, Internet và cả Android. Java hiện đang là ngôn ngữ lập trình rộng rãi nhất thế giới (trên cả C/C++)\n   Về cá nhân thì mình thấy nó là một món đồ chơi cũ nhưng vẫn rất đẹp và không chỉ có một mình mình chơi và nó không chỉ để chơi ^^\n}\nSau khi đọc bài viết của Vinacode - \"Phát triển Phần Mềm,nó là một tôn giáo\". Mình thấy nó có khá nhiều điểm tương đồng với những người thuộc \"Tôn giáo Java\", và bạn sẽ tự hỏi rằng nó có thật không? - XIn thưa, nó hoàn toàn có thật và hiện vẫn đang rất đông tín đồ.\nMột khi bạn bước chân vào Java, bất kể bạn thuộc mảng nào thì bạn cũng đang thuộc \"đạo Java\" đấy, tuy nhiên, đa phần các bạn xem nó như là một thứ ngôn ngữ bình thường, xài chán thì bỏ :) . Nhưng vẫn còn một bộ phận không ít người gắn mác \"Cuồng\" (cứ như bọn Sky ấy ^^)\nĐối với một JavaNerd, họ đi đâu cũng thấy Java, không chỉ trong mã, máy tính mà cả ở thế giới thực. Họ nhìn thấy một chiếc cốc cà phê có khói nóng tỏa thì họ sẽ nghĩ ngay đến biểu tượng của Java. Họ trước khi lập trình thì lại lẩm bẩm \"So help me Duke\" (Duke là linh vật của Java) hay trước khi ăn hay uống cà phê thì lại đọc thầm \"To the Duke\". (Giống như thiên chúa giáo ấy, ôi lạy Duke.)\nKhi nghe một ai đó chê bai Java thì lại phản ứng gay gắt, \"Thằng khốn, Duke sẽ nguyền rủa mày!!\" - Một JavaNerd cho hay. và còn nhiều thứ khác...\nMình không vơ đũa cả nắm nhưng chỉ với những biểu hiện ấy, bạn có thể phát hiện một JavaNerd nhưng lưu ý rằng - số lượng ngày càng tăng dần. (Như bọn Sky ấy ^^)\nMình hư cấu nãy giờ cũng khá nhiều rồi, và bây giờ mình sẽ vào vấn đề chính.\nVậy tại sao Java lại có sức hút như vậy?\nXét về khía cạnh Marketing thì Java đã rất thành công khi có xuất thân từ một gia đình danh giá là Sun Microsystem, có một biểu tượng rất quen thuộc - tách Café và tậu hẳn một linh vật khá là... mình chẳng biết nói sao nữa. Sau cái chết của Sun, thì Java cũng chẳng trở thành đứa trẻ \"mồ côi\", năm 2010, Oracle - một công ty khá nổi tiếng về dịch vụ và tài năng chặt chém tại Mỹ nhận nuôi và tiếp tục nuôi, cho ăn,... cho lớn. Tuy Java được ông trùm chặt chém nhận nuôi nhưng nó lại Free :) . Nên Java khá là sang chảnh.\nVề khía cạnh Ứng dụng, đi đâu cũng gặp Java, từ hệ thống máy giặt, tủ lạnh cao cấp, tivi màn hình cong (không phải cái này đâu :) ). tới hệ thống cao cấp hơn như Đập đá Nokia, Phần mềm máy tính và cả ứng dụng, hệ điều hành Android và cả tựa game đình đám MineCraft . Đây được xem như là bước đệm to đùng của Java để lên cao như ngày nay.\nChức năng của Java cũng không ít hấp dẫn, đó là một ngôn ngữ thuần OOP rất rõ ràng và đẹp (đẹp hơn cả Pascal), dễ dùng và dễ hiểu, Java có bộ dịch và môi trường thực thi để chạy ở mọi nơi. Java khá mạnh và an toàn (trừ mấy cái Plug in trên Web) và được thường xuyên được nâng cấp bởi Oracle và được thêm nhiều tính năng cao cấp như annotation, lambda,...\nJava có hệ thống lập trình viên đông đảo và động (năng động và cả... bạo động), tài liệu hướng dẫn thì nhiều vô số kể, các trang web dạy java cũng rất nhiều, ngay cả Daynhauhoc cũng có bộ phận đông đảo người dùng Java. Java cũng khá dễ dùng, dễ cài đặt, dễ chịu và dễ học. Khi học Java, nó sẽ dạy cho người học các khái niệm lập trình cơ bản và hướng đối tượng thật sự,... \nNgoài ra, Java còn có cả hệ thống Multimedia như Lady Java, Code Hard hay là những video đạo phim của JavaZone\nÔi! Java thật thần thánh.\nNhưng Java cũng có khá nhiều các yếu điểm.\n+Phức tạp: Hệ thống thư viện và lớp rất phong phú nhưng có nhiều cái đã hết sài (như là Date thì bị thay bằng Calendar).\n+Nâng cấp chậm: mặc dù Oracle đã nhận nuôi Java nhưng việc nâng cấp nó thì lại không như lúc dưới tay Sun, và cũng thua xa các ngôn ngữ lập trình khác về tốc độ nâng cấp.\n...\nmình hết biết gì để nói rồi ^^.\nVà đó là những lợi ích của Java và những yếu điểm của Java.\nKhuya rồi, mình đi ngủ đây. Ăn tết vui vẻ, anh em Daynhauhoc.\n","raw":"---json\n{\"id\":20388,\"layout\":\"Post\",\"route\":\"d-o-java-u-no-co-th-t-day\",\"title\":\"Đạo Java ư ? Nó có thật đấy\",\"tags\":[\"nerd\",\"java\"],\"date\":\"2016-02-01T15:45:40.342Z\",\"author\":{\"username\":\"conan4582\",\"avatar\":\"/user_avatar/daynhauhoc.com/conan4582/{size}/8110_1.png\"}}\n---\n\n```\nBài viết chỉ thể hiện quan điểm cá nhân dựa trên các số liệu và thu thập ý kiến\n```\nJava - một điệp khúc muôn thuở, một vũ khí uy lực gắn liền với nhiều người và là niềm tự hào của James và Sun micsys quá cố.\nclass SơLượcJava {\n   Java có tên ban đầu là Oak, do James Gosling thiết kế và công bố hoành tráng tại hội nghị SunWorld vào tháng 5-1995. Java là một ngôn ngữ thuần túy hướng đối tượng được sử dụng rộng rãi để viết ứng dụng đa nền, Internet và cả Android. Java hiện đang là ngôn ngữ lập trình rộng rãi nhất thế giới (trên cả C/C++)\n   Về cá nhân thì mình thấy nó là một món đồ chơi cũ nhưng vẫn rất đẹp và không chỉ có một mình mình chơi và nó không chỉ để chơi ^^\n}\nSau khi đọc bài viết của Vinacode - \"Phát triển Phần Mềm,nó là một tôn giáo\". Mình thấy nó có khá nhiều điểm tương đồng với những người thuộc \"Tôn giáo Java\", và bạn sẽ tự hỏi rằng nó có thật không? - XIn thưa, nó hoàn toàn có thật và hiện vẫn đang rất đông tín đồ.\nMột khi bạn bước chân vào Java, bất kể bạn thuộc mảng nào thì bạn cũng đang thuộc \"đạo Java\" đấy, tuy nhiên, đa phần các bạn xem nó như là một thứ ngôn ngữ bình thường, xài chán thì bỏ :) . Nhưng vẫn còn một bộ phận không ít người gắn mác \"Cuồng\" (cứ như bọn Sky ấy ^^)\nĐối với một JavaNerd, họ đi đâu cũng thấy Java, không chỉ trong mã, máy tính mà cả ở thế giới thực. Họ nhìn thấy một chiếc cốc cà phê có khói nóng tỏa thì họ sẽ nghĩ ngay đến biểu tượng của Java. Họ trước khi lập trình thì lại lẩm bẩm \"So help me Duke\" (Duke là linh vật của Java) hay trước khi ăn hay uống cà phê thì lại đọc thầm \"To the Duke\". (Giống như thiên chúa giáo ấy, ôi lạy Duke.)\nKhi nghe một ai đó chê bai Java thì lại phản ứng gay gắt, \"Thằng khốn, Duke sẽ nguyền rủa mày!!\" - Một JavaNerd cho hay. và còn nhiều thứ khác...\nMình không vơ đũa cả nắm nhưng chỉ với những biểu hiện ấy, bạn có thể phát hiện một JavaNerd nhưng lưu ý rằng - số lượng ngày càng tăng dần. (Như bọn Sky ấy ^^)\nMình hư cấu nãy giờ cũng khá nhiều rồi, và bây giờ mình sẽ vào vấn đề chính.\nVậy tại sao Java lại có sức hút như vậy?\nXét về khía cạnh Marketing thì Java đã rất thành công khi có xuất thân từ một gia đình danh giá là Sun Microsystem, có một biểu tượng rất quen thuộc - tách Café và tậu hẳn một linh vật khá là... mình chẳng biết nói sao nữa. Sau cái chết của Sun, thì Java cũng chẳng trở thành đứa trẻ \"mồ côi\", năm 2010, Oracle - một công ty khá nổi tiếng về dịch vụ và tài năng chặt chém tại Mỹ nhận nuôi và tiếp tục nuôi, cho ăn,... cho lớn. Tuy Java được ông trùm chặt chém nhận nuôi nhưng nó lại Free :) . Nên Java khá là sang chảnh.\nVề khía cạnh Ứng dụng, đi đâu cũng gặp Java, từ hệ thống máy giặt, tủ lạnh cao cấp, tivi màn hình cong (không phải cái này đâu :) ). tới hệ thống cao cấp hơn như Đập đá Nokia, Phần mềm máy tính và cả ứng dụng, hệ điều hành Android và cả tựa game đình đám MineCraft . Đây được xem như là bước đệm to đùng của Java để lên cao như ngày nay.\nChức năng của Java cũng không ít hấp dẫn, đó là một ngôn ngữ thuần OOP rất rõ ràng và đẹp (đẹp hơn cả Pascal), dễ dùng và dễ hiểu, Java có bộ dịch và môi trường thực thi để chạy ở mọi nơi. Java khá mạnh và an toàn (trừ mấy cái Plug in trên Web) và được thường xuyên được nâng cấp bởi Oracle và được thêm nhiều tính năng cao cấp như annotation, lambda,...\nJava có hệ thống lập trình viên đông đảo và động (năng động và cả... bạo động), tài liệu hướng dẫn thì nhiều vô số kể, các trang web dạy java cũng rất nhiều, ngay cả Daynhauhoc cũng có bộ phận đông đảo người dùng Java. Java cũng khá dễ dùng, dễ cài đặt, dễ chịu và dễ học. Khi học Java, nó sẽ dạy cho người học các khái niệm lập trình cơ bản và hướng đối tượng thật sự,... \nNgoài ra, Java còn có cả hệ thống Multimedia như Lady Java, Code Hard hay là những video đạo phim của JavaZone\nÔi! Java thật thần thánh.\nNhưng Java cũng có khá nhiều các yếu điểm.\n+Phức tạp: Hệ thống thư viện và lớp rất phong phú nhưng có nhiều cái đã hết sài (như là Date thì bị thay bằng Calendar).\n+Nâng cấp chậm: mặc dù Oracle đã nhận nuôi Java nhưng việc nâng cấp nó thì lại không như lúc dưới tay Sun, và cũng thua xa các ngôn ngữ lập trình khác về tốc độ nâng cấp.\n...\nmình hết biết gì để nói rồi ^^.\nVà đó là những lợi ích của Java và những yếu điểm của Java.\nKhuya rồi, mình đi ngủ đây. Ăn tết vui vẻ, anh em Daynhauhoc.\n","__filename":"posts/20388.md","__url":"/d-o-java-u-no-co-th-t-day/","__resourceUrl":"/d-o-java-u-no-co-th-t-day/index.html","__dataUrl":"/d-o-java-u-no-co-th-t-day/index.html.65ccc3e74e38011f4a6447b1ae42e7c6.json"}