{"head":{"id":15700,"layout":"Post","route":"javascript-debounce-function-la-gi","title":"JavaScript - Debounce function l√† g√¨?","tags":["ux","javascript"],"date":"2015-11-02T18:25:24.295Z","author":{"username":"vhnam","avatar":"/user_avatar/daynhauhoc.com/vhnam/{size}/1298_1.png"},"description":"L√∫c tr∆∞·ªõc m√¨nh c√≥ l√†m m·ªôt b√†i test y√™u c·∫ßu l√†m m·ªôt Instant Search nh∆∞ c·ªßa Twitter. Trong qu√° tr√¨nh l√†m, s·∫Ω ph√°t sinh m·ªôt tr∆∞·ªùng h·ª£p nh∆∞‚Ä¶"},"body":"<p>L√∫c tr∆∞·ªõc m√¨nh c√≥ l√†m m·ªôt b√†i test y√™u c·∫ßu l√†m m·ªôt Instant Search nh∆∞ c·ªßa Twitter. Trong qu√° tr√¨nh l√†m, s·∫Ω ph√°t sinh m·ªôt tr∆∞·ªùng h·ª£p nh∆∞ trong h√¨nh d∆∞·ªõi ƒë√¢y.</p>\n<p><a href=\"http://vhnam.github.io/blog/javascript-debounce-function-la-gi/images/example.png\">http://vhnam.github.io/blog/javascript-debounce-function-la-gi/images/example.png</a></p>\n<p>T·ª©c l√†, m√¨nh g·ªüi 3 request, th√¨ s·∫Ω c√≥ 3 response t∆∞∆°ng ·ª©ng. Nh∆∞ng m√¨nh ch·ªâ mu·ªën g·ªüi request th·ª© 3 v·ªõi t·ª´ kh√≥a <strong>&quot;abc&quot;</strong> nh∆∞ng response tr·∫£ v·ªÅ l·∫°i l√† d·ªØ li·ªáu c·ªßa t·ª´ kh√≥a <strong>&quot;ab&quot;</strong>. Nh∆∞ v·∫≠y k·∫øt qu·∫£ search c·ªßa ng∆∞·ªùi d√πng s·∫Ω b·ªã sai, ·∫£nh h∆∞·ªüng nghi√™m tr·ªçng t·ªõi UX. üò±</p>\n<p>M√¨nh ƒë∆∞·ª£c gi·ªõi thi·ªáu k·ªπ thu·∫≠t <strong>Debounce</strong> ƒë·ªÉ gi·∫£i quy·∫øt v·∫•n ƒë·ªÅ n√†y, s·∫µn ti·ªán vi·∫øt th√†nh blog ƒë·ªÉ chia s·∫ª lu√¥n üòâ</p>\n<p>M√¨nh c√≥ vi·∫øt ch∆∞a ƒë√∫ng ch·ªó n√†o, mong m·ªçi ng∆∞·ªùi ch·ªâ ch·ªó ƒë·ªÉ s·ª≠a.</p>\n<p><a href=\"http://vhnam.github.io/blog/javascript-debounce-function-la-gi/\">http://vhnam.github.io/blog/javascript-debounce-function-la-gi/</a></p>\n","rawBody":"\nL√∫c tr∆∞·ªõc m√¨nh c√≥ l√†m m·ªôt b√†i test y√™u c·∫ßu l√†m m·ªôt Instant Search nh∆∞ c·ªßa Twitter. Trong qu√° tr√¨nh l√†m, s·∫Ω ph√°t sinh m·ªôt tr∆∞·ªùng h·ª£p nh∆∞ trong h√¨nh d∆∞·ªõi ƒë√¢y.\n\nhttp://vhnam.github.io/blog/javascript-debounce-function-la-gi/images/example.png\n\nT·ª©c l√†, m√¨nh g·ªüi 3 request, th√¨ s·∫Ω c√≥ 3 response t∆∞∆°ng ·ª©ng. Nh∆∞ng m√¨nh ch·ªâ mu·ªën g·ªüi request th·ª© 3 v·ªõi t·ª´ kh√≥a **\"abc\"** nh∆∞ng response tr·∫£ v·ªÅ l·∫°i l√† d·ªØ li·ªáu c·ªßa t·ª´ kh√≥a **\"ab\"**. Nh∆∞ v·∫≠y k·∫øt qu·∫£ search c·ªßa ng∆∞·ªùi d√πng s·∫Ω b·ªã sai, ·∫£nh h∆∞·ªüng nghi√™m tr·ªçng t·ªõi UX. :scream:\n\nM√¨nh ƒë∆∞·ª£c gi·ªõi thi·ªáu k·ªπ thu·∫≠t **Debounce** ƒë·ªÉ gi·∫£i quy·∫øt v·∫•n ƒë·ªÅ n√†y, s·∫µn ti·ªán vi·∫øt th√†nh blog ƒë·ªÉ chia s·∫ª lu√¥n :wink:\n\nM√¨nh c√≥ vi·∫øt ch∆∞a ƒë√∫ng ch·ªó n√†o, mong m·ªçi ng∆∞·ªùi ch·ªâ ch·ªó ƒë·ªÉ s·ª≠a.\n\nhttp://vhnam.github.io/blog/javascript-debounce-function-la-gi/\n","raw":"---json\n{\"id\":15700,\"layout\":\"Post\",\"route\":\"javascript-debounce-function-la-gi\",\"title\":\"JavaScript - Debounce function l√† g√¨?\",\"tags\":[\"ux\",\"javascript\"],\"date\":\"2015-11-02T18:25:24.295Z\",\"author\":{\"username\":\"vhnam\",\"avatar\":\"/user_avatar/daynhauhoc.com/vhnam/{size}/1298_1.png\"}}\n---\n\nL√∫c tr∆∞·ªõc m√¨nh c√≥ l√†m m·ªôt b√†i test y√™u c·∫ßu l√†m m·ªôt Instant Search nh∆∞ c·ªßa Twitter. Trong qu√° tr√¨nh l√†m, s·∫Ω ph√°t sinh m·ªôt tr∆∞·ªùng h·ª£p nh∆∞ trong h√¨nh d∆∞·ªõi ƒë√¢y.\n\nhttp://vhnam.github.io/blog/javascript-debounce-function-la-gi/images/example.png\n\nT·ª©c l√†, m√¨nh g·ªüi 3 request, th√¨ s·∫Ω c√≥ 3 response t∆∞∆°ng ·ª©ng. Nh∆∞ng m√¨nh ch·ªâ mu·ªën g·ªüi request th·ª© 3 v·ªõi t·ª´ kh√≥a **\"abc\"** nh∆∞ng response tr·∫£ v·ªÅ l·∫°i l√† d·ªØ li·ªáu c·ªßa t·ª´ kh√≥a **\"ab\"**. Nh∆∞ v·∫≠y k·∫øt qu·∫£ search c·ªßa ng∆∞·ªùi d√πng s·∫Ω b·ªã sai, ·∫£nh h∆∞·ªüng nghi√™m tr·ªçng t·ªõi UX. :scream:\n\nM√¨nh ƒë∆∞·ª£c gi·ªõi thi·ªáu k·ªπ thu·∫≠t **Debounce** ƒë·ªÉ gi·∫£i quy·∫øt v·∫•n ƒë·ªÅ n√†y, s·∫µn ti·ªán vi·∫øt th√†nh blog ƒë·ªÉ chia s·∫ª lu√¥n :wink:\n\nM√¨nh c√≥ vi·∫øt ch∆∞a ƒë√∫ng ch·ªó n√†o, mong m·ªçi ng∆∞·ªùi ch·ªâ ch·ªó ƒë·ªÉ s·ª≠a.\n\nhttp://vhnam.github.io/blog/javascript-debounce-function-la-gi/\n","__filename":"posts/15700.md","__url":"/javascript-debounce-function-la-gi/","__resourceUrl":"/javascript-debounce-function-la-gi/index.html","__dataUrl":"/javascript-debounce-function-la-gi/index.html.e57c00e91e3607bf34f7d6cefe4cb52b.json"}