{"head":{"id":7871,"layout":"Post","route":"101-loi-co-ban-trong-lap-trinh-c","title":"101 Lỗi cơ bản trong Lập Trình C","tags":["c"],"date":"2015-06-01T14:15:36.242Z","description":"Tình cờ lụm được trên mạng nên chia sẻ ngay cho mọi người :)\n"},"body":"<p>Tình cờ lụm được trên mạng nên chia sẻ ngay cho mọi người :)</p>\n<pre><code>1. ( expected: thiếu ‘(‘ \n\n2. ) expected: thiếu ‘)’ \n\n3. , expected: thiếu ‘,’ \n\n4. : expected after private: thiếu ‘:’ sau private \n\n5. : expected after protected: thiếu ‘:’ sau protected \n\n6. : expected after public: thiếu ‘:’ sau public \n\n7. &lt; expected: thiếu dấu &lt; \n\n8. { expected:thiếu dấu { \n\n9. } expected: thiếu dấu } \n\n10. Array bounds missing ]: thiếu ‘]’ bao dãy \n\n11. Array must have at least one element: dãy phải có ít nhất một phần tử \n\n12. Array size too large: kích cỡ dãy quá lớn \n\n13. Body already defined for this function: nội dung hàm này đã được viết. \n\n14. Call of nonfunction: tên được gọi không được khai báo như một hàm, do khai \n\nbáo hàm không chính xác hoặc viết sai tên hàm. \n\n15. Cannot cast from &#x27;type1&#x27; to &#x27;type2&#x27;: không thể ép từ kiểu ‘type1’ đến kiểu \n\n&#x27;type2&#x27; \n\n16. Cannot convert &#x27;type1&#x27; to &#x27;type2&#x27;: không thể chuyển đổi &#x27;type1&#x27; thành &#x27;type2&#x27; \n\n17. Cannot modify a const object: không thể thay đổi một đối tượng hằng (const) \n\n18. Cannot overload &#x27;main&#x27;: không thể định nghĩa chồng hàm main \n\n19. Cannot use tiny or huge memory model with Windows: không thể sử dụng mô \n\nhình bộ nhớ tiny hoặc huge với Windows \n\n20. Cannot open such file or directory “xxx”: không thể mở file hoặc thư mục xxx \n\n21. Cannot open “Debug\\..” for writting: không thể mở file Debug\\.. để ghi (hãy \n\nđóng CT đã chạy trước đây để có thể chạy lại CT) \n\n22. Case outside of switch: ‘case’ bên ngoài switch \n\n23. Case statement missing ‘:’: ‘case’ thiếu dấu ‘:’ \n\n24. Character constant must be one or two characters long: hằng ký tự chỉ có thể \n\nlà một ký tự (‘a’) hoặc hai ký tự (‘\\n’) \n\n25. Compound statement missing }: thiếu dấu } cho khối lệnh (câu lệnh phức). \n\n26. Constant expression required: dãy phải được khai báo với kích thước là hằng số \n\n(thường là do khai báo hằng (#define) không đúng). \n\n27. Constant variable &#x27;variable&#x27; must be initialized: biến có kiểu const phải được \n\nkhởi tạo (vì ta không thể gán giá trị cho biến có kiểu const trong quá trình thi \n\nhành CT).\n\n28. Could not find a match for argument(s): các đối số không phù hợp (kiểm tra lại \n\nkhai báo hàm và các đối số truyền vào) \n\n29. Could not find file &#x27;filename&#x27;: không thể tìm file &#x27;filename&#x27; \n\n30. Declaration does not specify a tag or an identifier: khai báo (kiểu struct hoặc \n\nkiểu union) không chứa thành phần \n\n31. Declaration is not allowed here: không cho phép khai báo ở đây \n\n32. Declaration missing ‘;’: khai báo thiếu dấu ‘;’ \n\n33. Declaration syntax error: khai báo sai lỗi cú pháp \n\n34. Declaration terminated incorrectly: kết thúc khai báo không chính xác \n\n35. Declaration was expected: khai báo được mong muốn ở đây nhưng không tìm \n\nthấy \n\n36. Default argument value redeclared: giá trị của tham số mặc định bên trong hàm \n\nbị thay đổi \n\n37. Default argument value redeclared for parameter &#x27;parameter&#x27;: giá trị của \n\ntham số (đối số) mặc định &#x27;parameter&#x27; bên trong hàm bị thay đổi \n\n38. Default expression may not use local variables: một biểu thức tham số (đối số) \n\nmặc định bên trong hàm không được phép sử dụng tham số khác \n\n39. Default outside of switch: default bên ngoài switch \n\n40. Default value missing: tham số theo sau một tham số mặc định phải có giá trị \n\nmặc định \n\n41. Default value missing following parameter &#x27;parameter&#x27;: thiếu giá trị mặc định \n\ncho tham số &#x27;parameter&#x27; (vì nó theo sau một tham số mặc định nên phải có giá \n\ntrị mặc định) \n\n42. Define directive needs an identifier: khai báo define cần có một tên \n\n43. Delete array size missing ]: thiếu ‘]’ khi hủy một dãy \n\n44. Division by zero: chia cho 0 \n\n45. do statement must have while: do phải có while \n\n46. do-while statement missing (: do-while thiếu dấu ‘(’ \n\n47. do-while statement missing ): do-while thiếu dấu ‘)’ \n\n48. do-while statement missing ;: do-while thiếu dấu ‘;’ \n\n49. Duplicate case: mỗi case trong switch phải có giá trị đi kèm \n\n50. Enum syntax error: khai báo kiểu enum sai cú pháp \n\n51. Expression expected: một biểu thức được mong muốn ở đây nhưng ký hiệu hiện \n\nthời không thể bắt đầu cho một biểu thức \n\n52. Expression of scalar type expected: mong muốn biểu thức có kiểu vô hướng. \n\nCác toán tử !, ++, và – yêu cầu một biểu thức có kiểu vô hướng (char, short, int, \n\nlong, enum, float, double, long double, pointer) \n\n53. Expression syntax: cú pháp biểu thức \n\n54. File name too long: tên file qúa dài \n\n55. For statement missing ‘(‘: câu lệnh for thiếu ‘(’ \n\n56. For statement missing ): câu lệnh for thiếu ‘)’ \n\n57. For statement missing ;: câu lệnh for thiếu ‘)’ \n\n58. &#x27;function&#x27; cannot return a value: hàm không thể trả về giá trị (nó là hàm void) \n\n59. &#x27;function&#x27; must be declared with no parameters: hàm phải được khai báo với \n\nkhông tham số \n\n60. &#x27;function&#x27; must be declared with one parameter: hàm phải được khai báo với \n\nmột tham số Thực hành nhập môn lập trình\n\n61. &#x27;function&#x27; must be declared with two paraameters: hàm phải được khai báo với \n\nmột tham số \n\n62. &#x27;function1&#x27; cannot be distinguished from &#x27;function2&#x27;: không thể phân biệt \n\n&#x27;function1&#x27; với &#x27;function2&#x27; \n\n63. Function &#x27;function&#x27; should have a prototype: hàm &#x27;function&#x27; nên có tiêu đề. \n\n64. Function call missing ): thiếu dấu ‘)’ khi gọi hàm. \n\n65. Function should return a value: chưa trả về giá trị cho hàm \n\n66. &#x27;identifier&#x27; cannot start a parameter declaration: &#x27;identifier&#x27; không thể bắt đầu \n\ncho khai báo một tham số \n\n67. &#x27;identifier&#x27; is not a member of struct: &#x27;identifier&#x27; không phải là thành phần của \n\nstruct \n\n68. &#x27;identifier&#x27; is not a non-static member and can&#x27;t be initialized here: &#x27;identifier&#x27;  &#x27;không phải là một biến tĩnh và không thể được khởi tạo ở đây \n\n69. &#x27;identifier&#x27; is not a parameter: &#x27;identifier&#x27; không phải là một tham số \n\n70. Identifier expected: mong muốn một định danh \n\n71. If statement missing (: câu lệnh if thiếu ‘(‘ \n\n72. If statement missing ): câu lệnh if thiếu ‘)‘ \n\n73. Illegal character &#x27;character&#x27; (0x&#x27;value&#x27;): hằng ký tự sai \n\n74. Illegal structure operation: toán tử trên struct không đúng (chỉ có thể là: ‘.’, &amp;, \n\n=) \n\n75. Illegal use of floating point: toán tử trên số thực chấm động không đúng (chỉ có \n\nthể là: SHL, SHR, AND, OR, XOR, NOT, ? :, *, …) \n\n76. Improper use of typedef &#x27;identifier&#x27;: kiểm tra khai báo &#x27;identifier&#x27; ở dòng typedef \n\n77. Incorrect number format: định dạng số không đúng \n\n78. Incorrect use of default: sau default không có dấu ‘:’ \n\n79. Invalid use of dot: sử dụng dấu ‘.’ không đúng, ví dụ: \n\nstruct foo { \n\nint x; \n\nint y; \n\n}p = {0,0}; \n\n\n\nint main (…) \n\n{ \n\np.x++; /* Đúng */ \n\np. y++; /* Sai: Invalid use of dot */ \n\nreturn 0; \n\n} \n\n80. Lvalue required: thành phần bên trái của lệnh gán phải là biến \n\n81. main must have a return type of int: hàm main phải return về kiểu int \n\n82. Misplaced break: break không nằm trong switch hoặc một vòng lặp \n\n83. Misplaced continue: continue không nằm trong một vòng lặp \n\n84. Misplaced else: else không có if \n\n85. Missing xxx before yyy: thiếu xxx trước yyy \n\n86. Missing function header (old-style): sai tiêu đề ở phần định nghĩa hàm (có thể \n\nthừa dấu ; sau tiêu đề) \n\n87. Multiple declaration for &#x27;identifier&#x27;: trùng khai báo cho &#x27;identifier&#x27; \n\n88. Need an identifer to declare: cần một định danh cho khai báo \n\n89. No : following the ?: không có : sau ? trong cấu trúc tam phân (… ? … : … ) \n\n90. Not an allowed type: không cho phép ki���u này (chẳng hạn, không thể trả về dữ \n\nliệu kiểu mảng tĩnh cho hàm) \n\n91. Numeric constant too large: hằng số quá lớn \n\n92. new line in constant: thiếu dấu ” \n\n93. operator [] missing ]: toán tử [] thiếu ] \n\n94. sizeof may not be applied to a function: toán tử sizeof không thể áp dụng cho \n\nhàm \n\n95. Size of &#x27;identifier&#x27; is unknown or zero: kích thước của &#x27;identifier&#x27; không biết \n\nhoặc là 0 \n\n96. Size of the type is unknown or zero: kích thước của kiểu không biết hoặc là 0 \n\n97. Statement missing ‘;’: thiếu dấu ‘;’ \n\n98. Structure size too large: kích thước của struct quá lớn \n\n99. Switch selection expression must be of integral type: biểu thức chọn của switch \n\nphải là kiểu nguyên \n\n100. unexpected end of file: thiếu } \n\n101. xxx undeclared identifier: thiếu khai báo xxx\n</code></pre>\n","rawBody":"\nTình cờ lụm được trên mạng nên chia sẻ ngay cho mọi người :)\n\n    1. ( expected: thiếu ‘(‘ \n    \n    2. ) expected: thiếu ‘)’ \n    \n    3. , expected: thiếu ‘,’ \n    \n    4. : expected after private: thiếu ‘:’ sau private \n    \n    5. : expected after protected: thiếu ‘:’ sau protected \n    \n    6. : expected after public: thiếu ‘:’ sau public \n    \n    7. < expected: thiếu dấu < \n    \n    8. { expected:thiếu dấu { \n    \n    9. } expected: thiếu dấu } \n    \n    10. Array bounds missing ]: thiếu ‘]’ bao dãy \n    \n    11. Array must have at least one element: dãy phải có ít nhất một phần tử \n    \n    12. Array size too large: kích cỡ dãy quá lớn \n    \n    13. Body already defined for this function: nội dung hàm này đã được viết. \n    \n    14. Call of nonfunction: tên được gọi không được khai báo như một hàm, do khai \n    \n    báo hàm không chính xác hoặc viết sai tên hàm. \n    \n    15. Cannot cast from 'type1' to 'type2': không thể ép từ kiểu ‘type1’ đến kiểu \n    \n    'type2' \n    \n    16. Cannot convert 'type1' to 'type2': không thể chuyển đổi 'type1' thành 'type2' \n    \n    17. Cannot modify a const object: không thể thay đổi một đối tượng hằng (const) \n    \n    18. Cannot overload 'main': không thể định nghĩa chồng hàm main \n    \n    19. Cannot use tiny or huge memory model with Windows: không thể sử dụng mô \n    \n    hình bộ nhớ tiny hoặc huge với Windows \n    \n    20. Cannot open such file or directory “xxx”: không thể mở file hoặc thư mục xxx \n    \n    21. Cannot open “Debug\\..” for writting: không thể mở file Debug\\.. để ghi (hãy \n    \n    đóng CT đã chạy trước đây để có thể chạy lại CT) \n    \n    22. Case outside of switch: ‘case’ bên ngoài switch \n    \n    23. Case statement missing ‘:’: ‘case’ thiếu dấu ‘:’ \n    \n    24. Character constant must be one or two characters long: hằng ký tự chỉ có thể \n    \n    là một ký tự (‘a’) hoặc hai ký tự (‘\\n’) \n    \n    25. Compound statement missing }: thiếu dấu } cho khối lệnh (câu lệnh phức). \n    \n    26. Constant expression required: dãy phải được khai báo với kích thước là hằng số \n    \n    (thường là do khai báo hằng (#define) không đúng). \n    \n    27. Constant variable 'variable' must be initialized: biến có kiểu const phải được \n    \n    khởi tạo (vì ta không thể gán giá trị cho biến có kiểu const trong quá trình thi \n    \n    hành CT).\n    \n    28. Could not find a match for argument(s): các đối số không phù hợp (kiểm tra lại \n    \n    khai báo hàm và các đối số truyền vào) \n    \n    29. Could not find file 'filename': không thể tìm file 'filename' \n    \n    30. Declaration does not specify a tag or an identifier: khai báo (kiểu struct hoặc \n    \n    kiểu union) không chứa thành phần \n    \n    31. Declaration is not allowed here: không cho phép khai báo ở đây \n    \n    32. Declaration missing ‘;’: khai báo thiếu dấu ‘;’ \n    \n    33. Declaration syntax error: khai báo sai lỗi cú pháp \n    \n    34. Declaration terminated incorrectly: kết thúc khai báo không chính xác \n    \n    35. Declaration was expected: khai báo được mong muốn ở đây nhưng không tìm \n    \n    thấy \n    \n    36. Default argument value redeclared: giá trị của tham số mặc định bên trong hàm \n    \n    bị thay đổi \n    \n    37. Default argument value redeclared for parameter 'parameter': giá trị của \n    \n    tham số (đối số) mặc định 'parameter' bên trong hàm bị thay đổi \n    \n    38. Default expression may not use local variables: một biểu thức tham số (đối số) \n    \n    mặc định bên trong hàm không được phép sử dụng tham số khác \n    \n    39. Default outside of switch: default bên ngoài switch \n    \n    40. Default value missing: tham số theo sau một tham số mặc định phải có giá trị \n    \n    mặc định \n    \n    41. Default value missing following parameter 'parameter': thiếu giá trị mặc định \n    \n    cho tham số 'parameter' (vì nó theo sau một tham số mặc định nên phải có giá \n    \n    trị mặc định) \n    \n    42. Define directive needs an identifier: khai báo define cần có một tên \n    \n    43. Delete array size missing ]: thiếu ‘]’ khi hủy một dãy \n    \n    44. Division by zero: chia cho 0 \n    \n    45. do statement must have while: do phải có while \n    \n    46. do-while statement missing (: do-while thiếu dấu ‘(’ \n    \n    47. do-while statement missing ): do-while thiếu dấu ‘)’ \n    \n    48. do-while statement missing ;: do-while thiếu dấu ‘;’ \n    \n    49. Duplicate case: mỗi case trong switch phải có giá trị đi kèm \n    \n    50. Enum syntax error: khai báo kiểu enum sai cú pháp \n    \n    51. Expression expected: một biểu thức được mong muốn ở đây nhưng ký hiệu hiện \n    \n    thời không thể bắt đầu cho một biểu thức \n    \n    52. Expression of scalar type expected: mong muốn biểu thức có kiểu vô hướng. \n    \n    Các toán tử !, ++, và – yêu cầu một biểu thức có kiểu vô hướng (char, short, int, \n    \n    long, enum, float, double, long double, pointer) \n    \n    53. Expression syntax: cú pháp biểu thức \n    \n    54. File name too long: tên file qúa dài \n    \n    55. For statement missing ‘(‘: câu lệnh for thiếu ‘(’ \n    \n    56. For statement missing ): câu lệnh for thiếu ‘)’ \n    \n    57. For statement missing ;: câu lệnh for thiếu ‘)’ \n    \n    58. 'function' cannot return a value: hàm không thể trả về giá trị (nó là hàm void) \n    \n    59. 'function' must be declared with no parameters: hàm phải được khai báo với \n    \n    không tham số \n    \n    60. 'function' must be declared with one parameter: hàm phải được khai báo với \n    \n    một tham số Thực hành nhập môn lập trình\n    \n    61. 'function' must be declared with two paraameters: hàm phải được khai báo với \n    \n    một tham số \n    \n    62. 'function1' cannot be distinguished from 'function2': không thể phân biệt \n    \n    'function1' với 'function2' \n    \n    63. Function 'function' should have a prototype: hàm 'function' nên có tiêu đề. \n    \n    64. Function call missing ): thiếu dấu ‘)’ khi gọi hàm. \n    \n    65. Function should return a value: chưa trả về giá trị cho hàm \n    \n    66. 'identifier' cannot start a parameter declaration: 'identifier' không thể bắt đầu \n    \n    cho khai báo một tham số \n    \n    67. 'identifier' is not a member of struct: 'identifier' không phải là thành phần của \n    \n    struct \n    \n    68. 'identifier' is not a non-static member and can't be initialized here: 'identifier'  'không phải là một biến tĩnh và không thể được khởi tạo ở đây \n    \n    69. 'identifier' is not a parameter: 'identifier' không phải là một tham số \n    \n    70. Identifier expected: mong muốn một định danh \n    \n    71. If statement missing (: câu lệnh if thiếu ‘(‘ \n    \n    72. If statement missing ): câu lệnh if thiếu ‘)‘ \n    \n    73. Illegal character 'character' (0x'value'): hằng ký tự sai \n    \n    74. Illegal structure operation: toán tử trên struct không đúng (chỉ có thể là: ‘.’, &, \n    \n    =) \n    \n    75. Illegal use of floating point: toán tử trên số thực chấm động không đúng (chỉ có \n    \n    thể là: SHL, SHR, AND, OR, XOR, NOT, ? :, *, …) \n    \n    76. Improper use of typedef 'identifier': kiểm tra khai báo 'identifier' ở dòng typedef \n    \n    77. Incorrect number format: định dạng số không đúng \n    \n    78. Incorrect use of default: sau default không có dấu ‘:’ \n    \n    79. Invalid use of dot: sử dụng dấu ‘.’ không đúng, ví dụ: \n    \n    struct foo { \n    \n    int x; \n    \n    int y; \n    \n    }p = {0,0}; \n    \n    \n    \n    int main (…) \n    \n    { \n    \n    p.x++; /* Đúng */ \n    \n    p. y++; /* Sai: Invalid use of dot */ \n    \n    return 0; \n    \n    } \n    \n    80. Lvalue required: thành phần bên trái của lệnh gán phải là biến \n    \n    81. main must have a return type of int: hàm main phải return về kiểu int \n    \n    82. Misplaced break: break không nằm trong switch hoặc một vòng lặp \n    \n    83. Misplaced continue: continue không nằm trong một vòng lặp \n    \n    84. Misplaced else: else không có if \n    \n    85. Missing xxx before yyy: thiếu xxx trước yyy \n    \n    86. Missing function header (old-style): sai tiêu đề ở phần định nghĩa hàm (có thể \n    \n    thừa dấu ; sau tiêu đề) \n    \n    87. Multiple declaration for 'identifier': trùng khai báo cho 'identifier' \n    \n    88. Need an identifer to declare: cần một định danh cho khai báo \n    \n    89. No : following the ?: không có : sau ? trong cấu trúc tam phân (… ? … : … ) \n    \n    90. Not an allowed type: không cho phép ki���u này (chẳng hạn, không thể trả về dữ \n    \n    liệu kiểu mảng tĩnh cho hàm) \n    \n    91. Numeric constant too large: hằng số quá lớn \n    \n    92. new line in constant: thiếu dấu ” \n    \n    93. operator [] missing ]: toán tử [] thiếu ] \n    \n    94. sizeof may not be applied to a function: toán tử sizeof không thể áp dụng cho \n    \n    hàm \n    \n    95. Size of 'identifier' is unknown or zero: kích thước của 'identifier' không biết \n    \n    hoặc là 0 \n    \n    96. Size of the type is unknown or zero: kích thước của kiểu không biết hoặc là 0 \n    \n    97. Statement missing ‘;’: thiếu dấu ‘;’ \n    \n    98. Structure size too large: kích thước của struct quá lớn \n    \n    99. Switch selection expression must be of integral type: biểu thức chọn của switch \n    \n    phải là kiểu nguyên \n    \n    100. unexpected end of file: thiếu } \n    \n    101. xxx undeclared identifier: thiếu khai báo xxx\n","raw":"---json\n{\"id\":7871,\"layout\":\"Post\",\"route\":\"101-loi-co-ban-trong-lap-trinh-c\",\"title\":\"101 Lỗi cơ bản trong Lập Trình C\",\"tags\":[\"c\"],\"date\":\"2015-06-01T14:15:36.242Z\"}\n---\n\nTình cờ lụm được trên mạng nên chia sẻ ngay cho mọi người :)\n\n    1. ( expected: thiếu ‘(‘ \n    \n    2. ) expected: thiếu ‘)’ \n    \n    3. , expected: thiếu ‘,’ \n    \n    4. : expected after private: thiếu ‘:’ sau private \n    \n    5. : expected after protected: thiếu ‘:’ sau protected \n    \n    6. : expected after public: thiếu ‘:’ sau public \n    \n    7. < expected: thiếu dấu < \n    \n    8. { expected:thiếu dấu { \n    \n    9. } expected: thiếu dấu } \n    \n    10. Array bounds missing ]: thiếu ‘]’ bao dãy \n    \n    11. Array must have at least one element: dãy phải có ít nhất một phần tử \n    \n    12. Array size too large: kích cỡ dãy quá lớn \n    \n    13. Body already defined for this function: nội dung hàm này đã được viết. \n    \n    14. Call of nonfunction: tên được gọi không được khai báo như một hàm, do khai \n    \n    báo hàm không chính xác hoặc viết sai tên hàm. \n    \n    15. Cannot cast from 'type1' to 'type2': không thể ép từ kiểu ‘type1’ đến kiểu \n    \n    'type2' \n    \n    16. Cannot convert 'type1' to 'type2': không thể chuyển đổi 'type1' thành 'type2' \n    \n    17. Cannot modify a const object: không thể thay đổi một đối tượng hằng (const) \n    \n    18. Cannot overload 'main': không thể định nghĩa chồng hàm main \n    \n    19. Cannot use tiny or huge memory model with Windows: không thể sử dụng mô \n    \n    hình bộ nhớ tiny hoặc huge với Windows \n    \n    20. Cannot open such file or directory “xxx”: không thể mở file hoặc thư mục xxx \n    \n    21. Cannot open “Debug\\..” for writting: không thể mở file Debug\\.. để ghi (hãy \n    \n    đóng CT đã chạy trước đây để có thể chạy lại CT) \n    \n    22. Case outside of switch: ‘case’ bên ngoài switch \n    \n    23. Case statement missing ‘:’: ‘case’ thiếu dấu ‘:’ \n    \n    24. Character constant must be one or two characters long: hằng ký tự chỉ có thể \n    \n    là một ký tự (‘a’) hoặc hai ký tự (‘\\n’) \n    \n    25. Compound statement missing }: thiếu dấu } cho khối lệnh (câu lệnh phức). \n    \n    26. Constant expression required: dãy phải được khai báo với kích thước là hằng số \n    \n    (thường là do khai báo hằng (#define) không đúng). \n    \n    27. Constant variable 'variable' must be initialized: biến có kiểu const phải được \n    \n    khởi tạo (vì ta không thể gán giá trị cho biến có kiểu const trong quá trình thi \n    \n    hành CT).\n    \n    28. Could not find a match for argument(s): các đối số không phù hợp (kiểm tra lại \n    \n    khai báo hàm và các đối số truyền vào) \n    \n    29. Could not find file 'filename': không thể tìm file 'filename' \n    \n    30. Declaration does not specify a tag or an identifier: khai báo (kiểu struct hoặc \n    \n    kiểu union) không chứa thành phần \n    \n    31. Declaration is not allowed here: không cho phép khai báo ở đây \n    \n    32. Declaration missing ‘;’: khai báo thiếu dấu ‘;’ \n    \n    33. Declaration syntax error: khai báo sai lỗi cú pháp \n    \n    34. Declaration terminated incorrectly: kết thúc khai báo không chính xác \n    \n    35. Declaration was expected: khai báo được mong muốn ở đây nhưng không tìm \n    \n    thấy \n    \n    36. Default argument value redeclared: giá trị của tham số mặc định bên trong hàm \n    \n    bị thay đổi \n    \n    37. Default argument value redeclared for parameter 'parameter': giá trị của \n    \n    tham số (đối số) mặc định 'parameter' bên trong hàm bị thay đổi \n    \n    38. Default expression may not use local variables: một biểu thức tham số (đối số) \n    \n    mặc định bên trong hàm không được phép sử dụng tham số khác \n    \n    39. Default outside of switch: default bên ngoài switch \n    \n    40. Default value missing: tham số theo sau một tham số mặc định phải có giá trị \n    \n    mặc định \n    \n    41. Default value missing following parameter 'parameter': thiếu giá trị mặc định \n    \n    cho tham số 'parameter' (vì nó theo sau một tham số mặc định nên phải có giá \n    \n    trị mặc định) \n    \n    42. Define directive needs an identifier: khai báo define cần có một tên \n    \n    43. Delete array size missing ]: thiếu ‘]’ khi hủy một dãy \n    \n    44. Division by zero: chia cho 0 \n    \n    45. do statement must have while: do phải có while \n    \n    46. do-while statement missing (: do-while thiếu dấu ‘(’ \n    \n    47. do-while statement missing ): do-while thiếu dấu ‘)’ \n    \n    48. do-while statement missing ;: do-while thiếu dấu ‘;’ \n    \n    49. Duplicate case: mỗi case trong switch phải có giá trị đi kèm \n    \n    50. Enum syntax error: khai báo kiểu enum sai cú pháp \n    \n    51. Expression expected: một biểu thức được mong muốn ở đây nhưng ký hiệu hiện \n    \n    thời không thể bắt đầu cho một biểu thức \n    \n    52. Expression of scalar type expected: mong muốn biểu thức có kiểu vô hướng. \n    \n    Các toán tử !, ++, và – yêu cầu một biểu thức có kiểu vô hướng (char, short, int, \n    \n    long, enum, float, double, long double, pointer) \n    \n    53. Expression syntax: cú pháp biểu thức \n    \n    54. File name too long: tên file qúa dài \n    \n    55. For statement missing ‘(‘: câu lệnh for thiếu ‘(’ \n    \n    56. For statement missing ): câu lệnh for thiếu ‘)’ \n    \n    57. For statement missing ;: câu lệnh for thiếu ‘)’ \n    \n    58. 'function' cannot return a value: hàm không thể trả về giá trị (nó là hàm void) \n    \n    59. 'function' must be declared with no parameters: hàm phải được khai báo với \n    \n    không tham số \n    \n    60. 'function' must be declared with one parameter: hàm phải được khai báo với \n    \n    một tham số Thực hành nhập môn lập trình\n    \n    61. 'function' must be declared with two paraameters: hàm phải được khai báo với \n    \n    một tham số \n    \n    62. 'function1' cannot be distinguished from 'function2': không thể phân biệt \n    \n    'function1' với 'function2' \n    \n    63. Function 'function' should have a prototype: hàm 'function' nên có tiêu đề. \n    \n    64. Function call missing ): thiếu dấu ‘)’ khi gọi hàm. \n    \n    65. Function should return a value: chưa trả về giá trị cho hàm \n    \n    66. 'identifier' cannot start a parameter declaration: 'identifier' không thể bắt đầu \n    \n    cho khai báo một tham số \n    \n    67. 'identifier' is not a member of struct: 'identifier' không phải là thành phần của \n    \n    struct \n    \n    68. 'identifier' is not a non-static member and can't be initialized here: 'identifier'  'không phải là một biến tĩnh và không thể được khởi tạo ở đây \n    \n    69. 'identifier' is not a parameter: 'identifier' không phải là một tham số \n    \n    70. Identifier expected: mong muốn một định danh \n    \n    71. If statement missing (: câu lệnh if thiếu ‘(‘ \n    \n    72. If statement missing ): câu lệnh if thiếu ‘)‘ \n    \n    73. Illegal character 'character' (0x'value'): hằng ký tự sai \n    \n    74. Illegal structure operation: toán tử trên struct không đúng (chỉ có thể là: ‘.’, &, \n    \n    =) \n    \n    75. Illegal use of floating point: toán tử trên số thực chấm động không đúng (chỉ có \n    \n    thể là: SHL, SHR, AND, OR, XOR, NOT, ? :, *, …) \n    \n    76. Improper use of typedef 'identifier': kiểm tra khai báo 'identifier' ở dòng typedef \n    \n    77. Incorrect number format: định dạng số không đúng \n    \n    78. Incorrect use of default: sau default không có dấu ‘:’ \n    \n    79. Invalid use of dot: sử dụng dấu ‘.’ không đúng, ví dụ: \n    \n    struct foo { \n    \n    int x; \n    \n    int y; \n    \n    }p = {0,0}; \n    \n    \n    \n    int main (…) \n    \n    { \n    \n    p.x++; /* Đúng */ \n    \n    p. y++; /* Sai: Invalid use of dot */ \n    \n    return 0; \n    \n    } \n    \n    80. Lvalue required: thành phần bên trái của lệnh gán phải là biến \n    \n    81. main must have a return type of int: hàm main phải return về kiểu int \n    \n    82. Misplaced break: break không nằm trong switch hoặc một vòng lặp \n    \n    83. Misplaced continue: continue không nằm trong một vòng lặp \n    \n    84. Misplaced else: else không có if \n    \n    85. Missing xxx before yyy: thiếu xxx trước yyy \n    \n    86. Missing function header (old-style): sai tiêu đề ở phần định nghĩa hàm (có thể \n    \n    thừa dấu ; sau tiêu đề) \n    \n    87. Multiple declaration for 'identifier': trùng khai báo cho 'identifier' \n    \n    88. Need an identifer to declare: cần một định danh cho khai báo \n    \n    89. No : following the ?: không có : sau ? trong cấu trúc tam phân (… ? … : … ) \n    \n    90. Not an allowed type: không cho phép ki���u này (chẳng hạn, không thể trả về dữ \n    \n    liệu kiểu mảng tĩnh cho hàm) \n    \n    91. Numeric constant too large: hằng số quá lớn \n    \n    92. new line in constant: thiếu dấu ” \n    \n    93. operator [] missing ]: toán tử [] thiếu ] \n    \n    94. sizeof may not be applied to a function: toán tử sizeof không thể áp dụng cho \n    \n    hàm \n    \n    95. Size of 'identifier' is unknown or zero: kích thước của 'identifier' không biết \n    \n    hoặc là 0 \n    \n    96. Size of the type is unknown or zero: kích thước của kiểu không biết hoặc là 0 \n    \n    97. Statement missing ‘;’: thiếu dấu ‘;’ \n    \n    98. Structure size too large: kích thước của struct quá lớn \n    \n    99. Switch selection expression must be of integral type: biểu thức chọn của switch \n    \n    phải là kiểu nguyên \n    \n    100. unexpected end of file: thiếu } \n    \n    101. xxx undeclared identifier: thiếu khai báo xxx\n","__filename":"posts/7871.md","__url":"/101-loi-co-ban-trong-lap-trinh-c/","__resourceUrl":"/101-loi-co-ban-trong-lap-trinh-c/index.html","__dataUrl":"/101-loi-co-ban-trong-lap-trinh-c/index.html.d3b395e7cd70944a7c972cd66832e2cb.json"}